{
  "schemaVersion": "1",
  "toolkitVersion": "0.1.0",
  "agents": [
    {
      "id": "cursor",
      "enabled": true,
      "commandPrefix": "spec-n-"
    }
  ],
  "steps": [
    {
      "id": "specify",
      "kind": "built-in",
      "command": "spec-n-specify",
      "enabled": true,
      "outputs": ["spec.md"]
    },
    {
      "id": "tasks",
      "kind": "built-in",
      "command": "spec-n-tasks",
      "enabled": true,
      "outputs": ["tasks.md"]
    },
    {
      "id": "implement",
      "kind": "built-in",
      "command": "spec-n-implement",
      "enabled": true
    }
  ],
  "workflows": [
    {
      "id": "quick",
      "name": "Quick",
      "steps": ["specify", "tasks", "implement"],
      "default": true
    }
  ],
  "defaultWorkflowId": "quick"
}
